{
  "schema_version": 1,
  "book": {
    "role": "self_made",
    "subject": "语文",
    "grade": 1,
    "semester": "上册",
    "publisher": "自制",
    "edition_year": 2026,
    "title": "自编卷·语文一年级上（第一、二单元）",
    "source_file": "自编卷/语文第一二单元阶段自测卷.pdf",
    "description": "原创种子题库：范围 识字（一）＋园地一＋拼音1~4＋园地二（统编版 2024）。满分 100 分，限时 60 分钟。"
  },
  "source_textbook_title": "统编版语文一年级上册（2024）",
  "questions": [
    { "stem": "按顺序默写六个单韵母，写在四线格里。", "answer": "a、o、e、i、u、ü（写在四线格中格，占格正确即可）", "q_type": "默写", "difficulty": 1, "knowledge_points": ["单韵母（a o e i u ü）"], "source_page": "一", "status": "confirmed" },
    { "stem": "把下面的单韵母圈出来：\ne　b　u　m　o　f　a　d", "answer": "圈出：e、u、o、a", "q_type": "拼音", "difficulty": 1, "knowledge_points": ["单韵母（a o e i u ü）"], "source_page": "二、1", "status": "confirmed" },
    { "stem": "把下面的声母圈出来：\ni　n　u　p　e　t　o　l", "answer": "圈出：n、p、t、l", "q_type": "拼音", "difficulty": 1, "knowledge_points": ["声母（y w b p m f d t n l）"], "source_page": "二、2", "status": "confirmed" },
    { "stem": "把音节和它对应的汉字连起来：\nbà ba　mā ma　mǎ　tǔ　dà　lù\n右列：路、爸爸、大、妈妈、马、土", "answer": "bà ba—爸爸，mā ma—妈妈，mǎ—马，tǔ—土，dà—大，lù—路", "q_type": "连线", "difficulty": 1, "knowledge_points": ["两拼音节拼读"], "source_page": "三", "status": "confirmed" },
    { "stem": "选一选，把正确音节圈出来：土（tǔ　dǔ）", "options": ["tǔ", "dǔ"], "answer": "tǔ", "q_type": "选择", "difficulty": 1, "knowledge_points": ["音节正误辨析"], "source_page": "四、1", "status": "confirmed" },
    { "stem": "选一选，把正确音节圈出来：妈（mā　nā）", "options": ["mā", "nā"], "answer": "mā", "q_type": "选择", "difficulty": 1, "knowledge_points": ["音节正误辨析"], "source_page": "四、2", "status": "confirmed" },
    { "stem": "选一选，把正确音节圈出来：路（lù　nù）", "options": ["lù", "nù"], "answer": "lù", "q_type": "选择", "difficulty": 1, "knowledge_points": ["音节正误辨析"], "source_page": "四、3", "status": "confirmed" },
    { "stem": "选一选，把正确音节圈出来：爸（bà　pà）", "options": ["bà", "pà"], "answer": "bà", "q_type": "选择", "difficulty": 1, "knowledge_points": ["音节正误辨析"], "source_page": "四、4", "status": "confirmed" },
    { "stem": "选一选，把正确音节圈出来：马（mǎ　nǎ）", "options": ["mǎ", "nǎ"], "answer": "mǎ", "q_type": "选择", "difficulty": 1, "knowledge_points": ["音节正误辨析"], "source_page": "四、5", "status": "confirmed" },
    { "stem": "数笔画：“口”共（　）笔。", "answer": "3 笔", "q_type": "笔画", "difficulty": 1, "knowledge_points": ["笔画名称与形状"], "source_page": "五、1", "status": "confirmed" },
    { "stem": "数笔画：“火”共（　）笔。", "answer": "4 笔", "q_type": "笔画", "difficulty": 1, "knowledge_points": ["笔画名称与形状"], "source_page": "五、1", "status": "confirmed" },
    { "stem": "数笔画：“耳”共（　）笔。", "answer": "6 笔", "q_type": "笔画", "difficulty": 1, "knowledge_points": ["笔画名称与形状"], "source_page": "五、1", "status": "confirmed" },
    { "stem": "写出笔画名字对应的形状：竖 →（　）", "answer": "丨", "q_type": "笔画", "difficulty": 1, "knowledge_points": ["笔画名称与形状"], "source_page": "五、2", "status": "confirmed" },
    { "stem": "写出笔画名字对应的形状：撇 →（　）", "answer": "丿", "q_type": "笔画", "difficulty": 1, "knowledge_points": ["笔画名称与形状"], "source_page": "五、2", "status": "confirmed" },
    { "stem": "写出笔画名字对应的形状：捺 →（　）", "answer": "㇏（“人”字第二笔的形状）", "q_type": "笔画", "difficulty": 1, "knowledge_points": ["笔画名称与形状"], "source_page": "五、2", "status": "confirmed" },
    { "stem": "写出笔画名字对应的形状：点 →（　）", "answer": "丶", "q_type": "笔画", "difficulty": 1, "knowledge_points": ["笔画名称与形状"], "source_page": "五、2", "status": "confirmed" },
    { "stem": "听写：请家长读字，孩子把字写在田字格里。（听哪几个字见答案）", "answer": "二、上、口、日、火、王（家长逐个读，每个读两遍；写对字、占格居中即可）。笔顺参考：二（横横）、上（竖横横）、口（竖横折横）、日（竖横折横横）、火（点撇撇捺）、王（横横竖横）", "q_type": "听写", "difficulty": 2, "knowledge_points": ["田字格占格与书写"], "source_page": "六", "status": "confirmed" },
    { "stem": "把下面的字连成词语：\n天　上　手　日　水　山\n右列：下、足、地、水、月、火", "answer": "天—地，上—下，手—足，日—月，水—火，山—水", "q_type": "连线", "difficulty": 1, "knowledge_points": ["词语搭配与组词"], "source_page": "七、1", "status": "confirmed" },
    { "stem": "看拼音，在田字格里写汉字：mǎ", "answer": "马", "q_type": "拼音", "difficulty": 1, "knowledge_points": ["看拼音写汉字"], "source_page": "七、2", "status": "confirmed" },
    { "stem": "看拼音，在田字格里写汉字：tǔ", "answer": "土", "q_type": "拼音", "difficulty": 1, "knowledge_points": ["看拼音写汉字"], "source_page": "七、2", "status": "confirmed" },
    { "stem": "看拼音，在田字格里写汉字：mù", "answer": "目", "q_type": "拼音", "difficulty": 1, "knowledge_points": ["看拼音写汉字"], "source_page": "七、2", "status": "confirmed" },
    { "stem": "看拼音，在田字格里写汉字：bā", "answer": "八", "q_type": "拼音", "difficulty": 1, "knowledge_points": ["看拼音写汉字"], "source_page": "七、2", "status": "confirmed" },
    { "stem": "读一读，把韵母相同的字用线连起来：\n大　你　妈　七　爸　土　马　目\n右列（韵母）：a、u、a、i、a、u、a、i", "answer": "韵母 a：大、妈、爸、马；韵母 i：你、七；韵母 u：土、目", "q_type": "连线", "difficulty": 2, "knowledge_points": ["韵母归类"], "source_page": "八、1", "status": "confirmed" },
    { "stem": "按笔顺规则，把写得对的字圈出来：先横后竖：十、八", "options": ["十", "八"], "answer": "十（先横后竖）", "q_type": "选择", "difficulty": 2, "knowledge_points": ["笔顺规则（先横后竖、先撇后捺）"], "source_page": "八、2（1）", "status": "confirmed" },
    { "stem": "按笔顺规则，把写得对的字圈出来：先横后竖：田、口", "options": ["田", "口"], "answer": "田", "q_type": "选择", "difficulty": 2, "knowledge_points": ["笔顺规则（先横后竖、先撇后捺）"], "source_page": "八、2（2）", "status": "confirmed" },
    { "stem": "按笔顺规则，把写得对的字圈出来：先撇后捺：八、二", "options": ["八", "二"], "answer": "八（先撇后捺）", "q_type": "选择", "difficulty": 2, "knowledge_points": ["笔顺规则（先横后竖、先撇后捺）"], "source_page": "八、2（3）", "status": "confirmed" },
    { "stem": "按笔顺规则，把写得对的字圈出来：先撇后捺：禾、十", "options": ["禾", "十"], "answer": "禾（先撇后捺）", "q_type": "选择", "difficulty": 2, "knowledge_points": ["笔顺规则（先横后竖、先撇后捺）"], "source_page": "八、2（4）", "status": "confirmed" },
    { "stem": "把古诗和它的下一句连起来：\n鹅，鹅，鹅，／白毛浮绿水，／远看山有色，／春去花还在，\n右列：人来鸟不惊。／曲项向天歌。／红掌拨清波。／近听水无声。", "answer": "鹅，鹅，鹅——曲项向天歌；白毛浮绿水——红掌拨清波；远看山有色——近听水无声；春去花还在——人来鸟不惊", "q_type": "古诗", "difficulty": 2, "knowledge_points": ["古诗《咏鹅》《画》"], "source_page": "八、3", "status": "confirmed" },
    { "stem": "按顺序填一填：五、六、（　）、八、（　）、十", "answer": "七、九", "q_type": "填空", "difficulty": 1, "knowledge_points": ["数序汉字（五~十）"], "source_page": "八、4", "status": "confirmed" },
    { "stem": "照样子写笔画：竖弯钩、点，各写一个。", "answer": "竖弯钩（乚）、点（丶），形状对即可", "q_type": "笔画", "difficulty": 1, "knowledge_points": ["笔画名称与形状"], "source_page": "八、5", "status": "confirmed" },
    { "stem": "每行有一个不同的字，把它圈出来：\n第 1 行：天　天　人　天", "options": ["天", "人"], "answer": "圈“人”", "q_type": "选择", "difficulty": 2, "knowledge_points": ["形近字辨析"], "source_page": "九、1", "status": "confirmed" },
    { "stem": "每行有一个不同的字，把它圈出来：\n第 2 行：目　目　日　目", "options": ["目", "日"], "answer": "圈“日”", "q_type": "选择", "difficulty": 2, "knowledge_points": ["形近字辨析"], "source_page": "九、1", "status": "confirmed" },
    { "stem": "每行有一个不同的字，把它圈出来：\n第 3 行：上　上　下　上", "options": ["上", "下"], "answer": "圈“下”", "q_type": "选择", "difficulty": 2, "knowledge_points": ["形近字辨析"], "source_page": "九、1", "status": "confirmed" },
    { "stem": "猜字谜，把谜底写在田字格里：一加一，不是二。（打一个字）", "answer": "王（“十”字上下各添一横）", "q_type": "字谜", "difficulty": 3, "knowledge_points": ["字谜与趣味识字"], "source_page": "九、2", "status": "confirmed", "analysis": "一个“十”字上下各添一横，就是“王”。" },
    { "stem": "猜字谜，把谜底写在田字格里：四四方方一座城，十字藏在正当中。（打一个字）", "answer": "田（“十”放进“口”里）", "q_type": "字谜", "difficulty": 3, "knowledge_points": ["字谜与趣味识字"], "source_page": "九、2", "status": "confirmed" }
  ]
}
